{
  "title": "Synthetic Quarterly Business Review",
  "audience": "Internal review committee (synthetic)",
  "objective": "Communicate the prior quarter's qualitative performance, surface placeholder risks, and request decisions on two synthetic initiatives.",
  "tone": "neutral-professional",
  "language": "en",
  "approximate_slide_count": 20,
  "key_messages": [
    "Synthetic Team met its qualitative goals for the quarter.",
    "Two placeholder risks require a decision this cycle.",
    "Next quarter requires resourcing for one placeholder initiative."
  ],
  "constraints": {
    "must_include": [
      "Four placeholder KPIs",
      "Two synthetic decision requests"
    ],
    "must_avoid": [
      "Speculative financial guidance",
      "Any real customer or account reference"
    ]
  },
  "source_refs": [
    "synthetic_source_a",
    "synthetic_source_b"
  ]
}
